{
  "scheme_id": "dec5a6bf-c1de-51e9-93a5-5d9d54214812",
  "scheme_slug": "mj-fapm",
  "scheme_name": "Matru Jyothi - Financial Assistance For PwD Mothers",
  "version": "1.0.0",
  "last_updated": "2026-09-21T16:30:00Z",
  "root_logic": "AND",
  "rules": [
    {
      "rule_id": "rule_mj-fapm_01",
      "scheme_id": "dec5a6bf-c1de-51e9-93a5-5d9d54214812",
      "rule_type": "eligibility",
      "field": "gender",
      "operator": "=",
      "expected_value": "Female",
      "value_type": "string",
      "logic_group": "DEFAULT",
      "required": true,
      "hard_constraint": true,
      "condition": {
        "field": "gender",
        "op": "=",
        "val": "Female",
        "unit": null
      },
      "raw_text": "The applicant should be a differently abled mother.",
      "source_url": "https://www.myscheme.gov.in/schemes/mj-fapm",
      "source_document": "schemes_canonical.parquet",
      "source_page": null,
      "source_section": "eligibility",
      "confidence": 1.0,
      "provenance": {
        "source_dataset": "schemes_canonical.parquet",
        "extractor": "policy_rule_extractor_v1",
        "extraction_timestamp": "2026-09-21T16:30:00Z",
        "review_status": "VERIFIED_DETERMINISTIC"
      }
    },
    {
      "rule_id": "rule_mj-fapm_02",
      "scheme_id": "dec5a6bf-c1de-51e9-93a5-5d9d54214812",
      "rule_type": "eligibility",
      "field": "has_child_under_two_years",
      "operator": "is_true",
      "expected_value": true,
      "value_type": "boolean",
      "logic_group": "DEFAULT",
      "required": true,
      "hard_constraint": true,
      "condition": {
        "field": "has_child_under_two_years",
        "op": "is_true",
        "val": true,
        "unit": null
      },
      "raw_text": "The differently abled mother who has a child less than two years old is eligible to apply under the scheme.",
      "source_url": "https://www.myscheme.gov.in/schemes/mj-fapm",
      "source_document": "schemes_canonical.parquet",
      "source_page": null,
      "source_section": "eligibility",
      "confidence": 1.0,
      "provenance": {
        "source_dataset": "schemes_canonical.parquet",
        "extractor": "policy_rule_extractor_v1",
        "extraction_timestamp": "2026-09-21T16:30:00Z",
        "review_status": "VERIFIED_DETERMINISTIC"
      }
    },
    {
      "rule_id": "rule_mj-fapm_03",
      "scheme_id": "dec5a6bf-c1de-51e9-93a5-5d9d54214812",
      "rule_type": "eligibility",
      "field": "disability_percentage",
      "operator": ">=",
      "expected_value": 40,
      "value_type": "numeric",
      "logic_group": "DEFAULT",
      "required": true,
      "hard_constraint": true,
      "condition": {
        "field": "disability_percentage",
        "op": ">=",
        "val": 40,
        "unit": "percent"
      },
      "raw_text": "The applicant with the following type of disability with 40% or more will be considered under the scheme: Blindness, Low vision, Locomotor disability, Hearing impairment.",
      "source_url": "https://www.myscheme.gov.in/schemes/mj-fapm",
      "source_document": "schemes_canonical.parquet",
      "source_page": null,
      "source_section": "eligibility",
      "confidence": 0.95,
      "provenance": {
        "source_dataset": "schemes_canonical.parquet",
        "extractor": "policy_rule_extractor_v1",
        "extraction_timestamp": "2026-09-21T16:30:00Z",
        "review_status": "VERIFIED_DETERMINISTIC"
      }
    },
    {
      "rule_id": "rule_mj-fapm_04",
      "scheme_id": "dec5a6bf-c1de-51e9-93a5-5d9d54214812",
      "rule_type": "eligibility",
      "field": "annual_family_income",
      "operator": "<=",
      "expected_value": 100000,
      "value_type": "numeric",
      "logic_group": "DEFAULT",
      "required": true,
      "hard_constraint": true,
      "condition": {
        "field": "annual_family_income",
        "op": "<=",
        "val": 100000,
        "unit": "INR"
      },
      "raw_text": "The applicant's annual family income should not exceed ₹1,00,000/-.",
      "source_url": "https://www.myscheme.gov.in/schemes/mj-fapm",
      "source_document": "schemes_canonical.parquet",
      "source_page": null,
      "source_section": "eligibility",
      "confidence": 1.0,
      "provenance": {
        "source_dataset": "schemes_canonical.parquet",
        "extractor": "policy_rule_extractor_v1",
        "extraction_timestamp": "2026-09-21T16:30:00Z",
        "review_status": "VERIFIED_DETERMINISTIC"
      }
    }
  ]
}